{
  "prospect": { "name": "Acme Rockets", "short": "Acme", "domain": "acmerockets.com" },
  "title": "Acme Parts Depot",
  "tagline": "Made for Acme Rockets by PostHog",
  "palette": { "primary": "#e0402a", "secondary": "#1c2a4a", "accent": "#f7c948" },
  "products": ["session_replay", "feature_flags", "experiments", "error_tracking"],
  "music": { "mood": "busy launch-day countdown, driving chiptune, hangar hum", "bpm": 132 },
  "text": {
    "win": "Every satellite got its parts before launch. Nobody found out about a problem from a customer this week.",
    "lose": "Too many parts missed their launch window. Scrub, refuel, and pack again.",
    "credits": "Made for the Acme Rockets crew by PostHog"
  },
  "game": {
    "difficulty": "hard",
    "store": { "name": "Acme Parts Depot", "sprite_prompt": "grey hangar floor plates with yellow hazard stripes, seen from above" },
    "manager": { "name": "Flight Lead", "title": "Launch Ops", "sprite_prompt": "a launch engineer with a headset and a red flight jacket" },
    "items": [
      { "name": "Bolts", "sprite_prompt": "a small pile of silver bolts" },
      { "name": "Fuel Cell", "sprite_prompt": "a red fuel canister with a white stripe" },
      { "name": "Antenna", "sprite_prompt": "a small white dish antenna" },
      { "name": "Solar Panel", "sprite_prompt": "a blue folding solar panel", "fragile": true },
      { "name": "Nose Cone", "sprite_prompt": "a white rocket nose cone with a red tip" },
      { "name": "Thruster", "sprite_prompt": "a grey rocket thruster nozzle" },
      { "name": "Sensor", "sprite_prompt": "a gold telemetry sensor with a glass lens", "fragile": true },
      { "name": "Heat Tile", "sprite_prompt": "a black heat shield tile" }
    ],
    "hot_item": { "name": "Mini Sat", "sprite_prompt": "a tiny cube satellite with gold foil and solar wings" },
    "customers": ["Orbitly", "Nova", "Kepler", "Luna", "Vega", "Juno"],
    "docks": { "standard": "GROUND", "express": "PRIORITY", "international": "ORBIT" },
    "days": [
      { "intro": "Launch season. Operators need parts on the pad, not in a spreadsheet. Pack them right, ship them fast." },
      { "intro": "Priority orders today: a launch window waits for nobody, and neither do these customers." },
      { "intro": "Sensors and solar panels crack if you look at them wrong. Bubble wrap before they go in the box." },
      { "intro": "The belt keeps stopping and nobody trusts it. Pull the lever, keep shipping. Two Mini Sats in stock!" },
      { "intro": "Every operator wants parts before the launch window closes. It is going to be a long, loud day." }
    ],
    "jam": { "name": "FLAKY BELT" },
    "rush": { "name": "LAUNCH WINDOW" }
  }
}
